{
  "schemaVersion": "0.1.0",
  "id": "example_kontakt_strings_vln1",
  "engine": "Kontakt",
  "library": "Example Strings",
  "patch": "Violin 1",
  "noteNaming": "C3=60",
  "playableRange": {
    "low": 55,
    "high": 103
  },
  "articulations": [
    {
      "id": "legato",
      "name": "Legato",
      "type": "long",
      "trigger": { "type": "keyswitch", "note": 24, "noteName": "C0", "mode": "latch" },
      "defaultMacro": "natural_swell",
      "expressionBehavior": { "velocityRole": "secondary", "ccRole": "primary" }
    },
    {
      "id": "sustain",
      "name": "Sustain",
      "type": "long",
      "trigger": { "type": "keyswitch", "note": 25, "noteName": "C#0", "mode": "latch" },
      "expressionBehavior": { "velocityRole": "secondary", "ccRole": "primary" }
    },
    {
      "id": "spiccato",
      "name": "Spiccato",
      "type": "short",
      "trigger": { "type": "keyswitch", "note": 26, "noteName": "D0", "mode": "latch" },
      "expressionBehavior": { "velocityRole": "primary", "ccRole": "secondary" }
    }
  ],
  "ccMappings": [
    {
      "internalParameter": "intensity",
      "target": { "type": "cc", "cc": 1 },
      "curveId": "dynamic_default",
      "smoothingMs": 40,
      "inputCc": 1
    },
    {
      "internalParameter": "volume",
      "target": { "type": "cc", "cc": 11 },
      "curveId": "expression_default",
      "smoothingMs": 40
    },
    {
      "internalParameter": "vibratoDepth",
      "target": { "type": "cc", "cc": 21 },
      "curveId": "linear_full"
    }
  ],
  "calibrationCurves": [
    {
      "id": "dynamic_default",
      "inputRange": [0.0, 1.0],
      "outputRange": [0, 127],
      "interpolation": "monotonic",
      "points": [
        { "input": 0.0, "output": 8 },
        { "input": 0.25, "output": 35 },
        { "input": 0.5, "output": 68 },
        { "input": 0.75, "output": 96 },
        { "input": 1.0, "output": 120 }
      ]
    },
    {
      "id": "expression_default",
      "inputRange": [0.0, 1.0],
      "outputRange": [0, 127],
      "interpolation": "monotonic",
      "points": [
        { "input": 0.0, "output": 20 },
        { "input": 0.5, "output": 90 },
        { "input": 1.0, "output": 127 }
      ]
    },
    {
      "id": "linear_full",
      "inputRange": [0.0, 1.0],
      "outputRange": [0, 127],
      "interpolation": "linear",
      "points": [
        { "input": 0.0, "output": 0 },
        { "input": 1.0, "output": 127 }
      ]
    }
  ]
}
